{
  "record_id": "iaf:example:mechanism-pilot",
  "record_type": "IAF-26",
  "schema_version": "IAF/1.2",
  "created_at": "2026-08-06T00:00:00Z",
  "effective_at": null,
  "expires_at": "2026-11-06T00:00:00Z",
  "status": "proposed",
  "normative_force": "procedural",
  "authority_effect": "procedural_support",
  "action_class": "G",
  "source_framework_id": "IAF",
  "source_framework_version": "1.2",
  "source_record_ids": [],
  "supersedes": [],
  "superseded_by": [],
  "actor_id": "local-implementation-principal",
  "actor_type": "public_body",
  "office_or_role": "implementation_sponsor",
  "representation_source": "municipal programme charter",
  "technical_credential_refs": [],
  "constituting_instrument": "Municipal health pilot charter section 4",
  "legal_power": "Authority to conduct a voluntary service-improvement pilot",
  "jurisdiction_territorial": "example municipality",
  "jurisdiction_personal": null,
  "jurisdiction_subject_matter": "bounded implementation support",
  "jurisdiction_temporal": "pilot period only",
  "affected_party_refs": [
    "residents",
    "frontline-workers"
  ],
  "affected_indigenous_nation_refs": [],
  "protected_domain_flags": [],
  "consent_record_refs": [],
  "authority_record_refs": [
    "iaf:authority:clinic-pilot"
  ],
  "activation_record_refs": [],
  "access_class": "PUBLIC",
  "public_summary": "Proposal for a bounded mechanism pilot testing whether appointment reminders reduce missed clinic visits.",
  "protected_annex_refs": [],
  "data_purpose": "Demonstrate IAF v1.2 machine-readable conformance.",
  "retention_rule": "Retain through review and closure; archive superseded versions.",
  "correction_status": "none",
  "challenge_status": "open",
  "review_due_at": "2026-10-01T00:00:00Z",
  "closure_state": "open",
  "unresolved_duty_refs": [],
  "handoff_state": "not_applicable",
  "recipient_refs": [],
  "recipient_acceptance_refs": [],
  "hashes_and_signatures": [
    {
      "algorithm": "sha256",
      "value": "example-not-a-release-hash",
      "purpose": "illustrative integrity marker"
    }
  ],
  "human_accountable_officer": "named-human-officer",
  "prohibited_inferences": [
    "Schema validity does not establish authority, legitimacy, causal effectiveness, scaling permission, or durability."
  ],
  "consequence_profile": "CP2",
  "pilot_type": "mechanism",
  "pilot_complexity_band": "B2",
  "authority_formation": null,
  "response_duty_effect": "charter_internal",
  "response_duty_source": "Municipal health pilot charter section 7",
  "acknowledgment_clock_source": null,
  "decision_clock_source": null,
  "response_time_assessment_ref": null,
  "provisional_safe_state_record_ref": null,
  "post_acceptance_action_clock_ref": null,
  "iaf_payload": {
    "implementation_principal_ref": "local-implementation-principal",
    "objective": "Reduce missed clinic visits without restricting access.",
    "claimed_causal_mechanism": "Timely reminders reduce avoidable forgetting and scheduling confusion.",
    "controlled_variables": [
      "reminder timing",
      "message format",
      "opt-out process"
    ],
    "upstream_dependency_refs": [
      "clinic-scheduling-system"
    ],
    "pilot_question": "Does the reminder mechanism reduce missed visits under the tested conditions?",
    "conclusions_not_supported": [
      "system-wide health improvement",
      "long-term institutionalization",
      "transferability to other services"
    ],
    "minimum_causal_adequacy_status": "adequate_for_claim",
    "ordinary_owner_ref": null,
    "support_withdrawal_plan_ref": null,
    "compatibility_effect": null,
    "learning_sample_limits": []
  }
}
