{
  "record_id": "iaf:example:ordinary-ownership-transition",
  "record_type": "IAF-45",
  "schema_version": "IAF/1.2",
  "created_at": "2026-08-06T00:00:00Z",
  "effective_at": null,
  "expires_at": "2026-11-06T00:00:00Z",
  "status": "proposed",
  "normative_force": "procedural",
  "authority_effect": "procedural_support",
  "action_class": "N",
  "source_framework_id": "IAF",
  "source_framework_version": "1.2",
  "source_record_ids": [],
  "supersedes": [],
  "superseded_by": [],
  "actor_id": "local-implementation-principal",
  "actor_type": "public_body",
  "office_or_role": "implementation_sponsor",
  "representation_source": "municipal programme charter",
  "technical_credential_refs": [],
  "constituting_instrument": "Municipal service ordinance adoption process",
  "legal_power": "Referral only; enactment remains with municipal council",
  "jurisdiction_territorial": "example municipality",
  "jurisdiction_personal": null,
  "jurisdiction_subject_matter": "bounded implementation support",
  "jurisdiction_temporal": "pilot period only",
  "affected_party_refs": [
    "residents",
    "frontline-workers"
  ],
  "affected_indigenous_nation_refs": [],
  "protected_domain_flags": [],
  "consent_record_refs": [],
  "authority_record_refs": [],
  "activation_record_refs": [],
  "access_class": "PUBLIC",
  "public_summary": "Referral for institutionalization after a successful operational pilot, with ordinary ownership and support withdrawal conditions.",
  "protected_annex_refs": [],
  "data_purpose": "Demonstrate IAF v1.2 machine-readable conformance.",
  "retention_rule": "Retain through review and closure; archive superseded versions.",
  "correction_status": "none",
  "challenge_status": "open",
  "review_due_at": "2026-10-01T00:00:00Z",
  "closure_state": "open",
  "unresolved_duty_refs": [],
  "handoff_state": "offered",
  "recipient_refs": [
    "municipal-council"
  ],
  "recipient_acceptance_refs": [],
  "hashes_and_signatures": [
    {
      "algorithm": "sha256",
      "value": "example-not-a-release-hash",
      "purpose": "illustrative integrity marker"
    }
  ],
  "human_accountable_officer": "named-human-officer",
  "prohibited_inferences": [
    "Schema validity does not establish authority, legitimacy, causal effectiveness, scaling permission, or durability."
  ],
  "consequence_profile": "CP2",
  "pilot_type": "institutionalization",
  "pilot_complexity_band": "B3",
  "authority_formation": "retained",
  "response_duty_effect": "charter_internal",
  "response_duty_source": "Council procedure rule 8",
  "acknowledgment_clock_source": "Council procedure rule 8",
  "decision_clock_source": "Council procedure rule 8",
  "response_time_assessment_ref": null,
  "provisional_safe_state_record_ref": null,
  "post_acceptance_action_clock_ref": null,
  "iaf_payload": {
    "implementation_principal_ref": "local-implementation-principal",
    "objective": "Determine whether ordinary institutions can maintain the service after exceptional support ends.",
    "claimed_causal_mechanism": "Stable ownership, recurrent finance, staffing, and maintenance preserve delivery after pilot support withdrawal.",
    "controlled_variables": [
      "handover schedule",
      "training",
      "documentation"
    ],
    "upstream_dependency_refs": [
      "municipal-budget-cycle",
      "collective-bargaining-process"
    ],
    "pilot_question": "Can the ordinary owner maintain and adapt the service after exceptional support ends?",
    "conclusions_not_supported": [
      "universal scalability",
      "permanent superiority"
    ],
    "minimum_causal_adequacy_status": "adequate_for_claim",
    "ordinary_owner_ref": "municipal-service-department",
    "support_withdrawal_plan_ref": "iaf:support-withdrawal:001",
    "compatibility_effect": null,
    "learning_sample_limits": [
      "single municipality",
      "one budget cycle"
    ]
  }
}
