{
  "record_id": "iaf:example:capacity-limited-handoff",
  "record_type": "IAF-47",
  "schema_version": "IAF/1.2",
  "created_at": "2026-08-06T00:00:00Z",
  "effective_at": null,
  "expires_at": "2026-11-06T00:00:00Z",
  "status": "proposed",
  "normative_force": "procedural",
  "authority_effect": "procedural_support",
  "action_class": "O",
  "source_framework_id": "IAF",
  "source_framework_version": "1.2",
  "source_record_ids": [],
  "supersedes": [],
  "superseded_by": [],
  "actor_id": "local-implementation-principal",
  "actor_type": "public_body",
  "office_or_role": "implementation_sponsor",
  "representation_source": "municipal programme charter",
  "technical_credential_refs": [],
  "constituting_instrument": "Regional service statute section 12",
  "legal_power": "Jurisdiction over regional service implementation",
  "jurisdiction_territorial": "example municipality",
  "jurisdiction_personal": null,
  "jurisdiction_subject_matter": "bounded implementation support",
  "jurisdiction_temporal": "pilot period only",
  "affected_party_refs": [
    "residents",
    "frontline-workers"
  ],
  "affected_indigenous_nation_refs": [],
  "protected_domain_flags": [],
  "consent_record_refs": [],
  "authority_record_refs": [],
  "activation_record_refs": [],
  "access_class": "PUBLIC",
  "public_summary": "Handoff accepted in jurisdiction but marked capacity_limited because the recipient lacks implementation staff.",
  "protected_annex_refs": [],
  "data_purpose": "Demonstrate IAF v1.2 machine-readable conformance.",
  "retention_rule": "Retain through review and closure; archive superseded versions.",
  "correction_status": "none",
  "challenge_status": "open",
  "review_due_at": "2026-10-01T00:00:00Z",
  "closure_state": "open",
  "unresolved_duty_refs": [],
  "handoff_state": "capacity_limited",
  "recipient_refs": [
    "regional-service-authority"
  ],
  "recipient_acceptance_refs": [
    "acceptance:regional:2026-08-06"
  ],
  "hashes_and_signatures": [
    {
      "algorithm": "sha256",
      "value": "example-not-a-release-hash",
      "purpose": "illustrative integrity marker"
    }
  ],
  "human_accountable_officer": "named-human-officer",
  "prohibited_inferences": [
    "Schema validity does not establish authority, legitimacy, causal effectiveness, scaling permission, or durability."
  ],
  "consequence_profile": "CP2",
  "pilot_type": "not_applicable",
  "pilot_complexity_band": "not_applicable",
  "authority_formation": "retained",
  "response_duty_effect": "legal",
  "response_duty_source": "Regional service statute section 19",
  "acknowledgment_clock_source": "GMEAIA-07 assessment and statute section 19",
  "decision_clock_source": "Regional service statute section 19",
  "response_time_assessment_ref": "gmeia:response-assessment:regional-001",
  "provisional_safe_state_record_ref": "iaf:safe-state:continuity-001",
  "post_acceptance_action_clock_ref": "iaf:action-clock:staffing-001",
  "iaf_payload": {
    "implementation_principal_ref": "local-implementation-principal",
    "objective": "Transfer implementation custody without misclassifying missing staff as absent jurisdiction.",
    "claimed_causal_mechanism": null,
    "controlled_variables": [],
    "upstream_dependency_refs": [
      "regional-staffing-budget"
    ],
    "pilot_question": null,
    "conclusions_not_supported": [],
    "minimum_causal_adequacy_status": "upstream_action_required",
    "ordinary_owner_ref": null,
    "support_withdrawal_plan_ref": null,
    "compatibility_effect": null,
    "learning_sample_limits": []
  }
}
